profiled-configs/N=1024,K=8192,device_name=0x7551,dtype=fp8_w8a8,block_shape=[128,128].json
{
    "16": {
        "BLOCK_SIZE_M": 16,
        "BLOCK_SIZE_N": 32,
        "BLOCK_SIZE_K": 128,
        "GROUP_SIZE_M": 4,
        "num_warps": 4,
        "kpack": 4,
        "matrix_instr_nonkdim": 16
    },
    "32": {
        "BLOCK_SIZE_M": 16,
        "BLOCK_SIZE_N": 16,
        "BLOCK_SIZE_K": 128,
        "GROUP_SIZE_M": 4,
        "num_warps": 4,
        "kpack": 2,
        "matrix_instr_nonkdim": 16
    },
    "64": {
        "BLOCK_SIZE_M": 16,
        "BLOCK_SIZE_N": 32,
        "BLOCK_SIZE_K": 128,
        "GROUP_SIZE_M": 16,
        "num_warps": 4,
        "kpack": 4,
        "matrix_instr_nonkdim": 16
    },
    "128": {
        "BLOCK_SIZE_M": 128,
        "BLOCK_SIZE_N": 16,
        "BLOCK_SIZE_K": 128,
        "GROUP_SIZE_M": 8,
        "num_warps": 4,
        "kpack": 1,
        "matrix_instr_nonkdim": 16
    },
    "256": {
        "BLOCK_SIZE_M": 128,
        "BLOCK_SIZE_N": 32,
        "BLOCK_SIZE_K": 128,
        "GROUP_SIZE_M": 1,
        "num_warps": 4,
        "kpack": 2,
        "matrix_instr_nonkdim": 16
    },
    "512": {
        "BLOCK_SIZE_M": 128,
        "BLOCK_SIZE_N": 32,
        "BLOCK_SIZE_K": 128,
        "GROUP_SIZE_M": 8,
        "num_warps": 4,
        "kpack": 4,
        "matrix_instr_nonkdim": 16
    },
    "1024": {
        "BLOCK_SIZE_M": 64,
        "BLOCK_SIZE_N": 32,
        "BLOCK_SIZE_K": 128,
        "GROUP_SIZE_M": 32,
        "num_warps": 4,
        "kpack": 2,
        "matrix_instr_nonkdim": 16
    },
    "2048": {
        "BLOCK_SIZE_M": 128,
        "BLOCK_SIZE_N": 32,
        "BLOCK_SIZE_K": 128,
        "GROUP_SIZE_M": 8,
        "num_warps": 4,
        "kpack": 2,
        "matrix_instr_nonkdim": 16
    },
    "4096": {
        "BLOCK_SIZE_M": 128,
        "BLOCK_SIZE_N": 32,
        "BLOCK_SIZE_K": 128,
        "GROUP_SIZE_M": 8,
        "num_warps": 4,
        "kpack": 1,
        "matrix_instr_nonkdim": 16
    }
}